{
  "$schema": "https://json-schema.org/draft/2020-12/schema",
  "$id": "https://aurelius.dev/renderer.schema.json",
  "title": "Renderer Manifest",
  "type": "object",
  "additionalProperties": false,
  "required": [
    "name",
    "language",
    "detect",
    "template",
    "component",
    "test",
    "converter",
    "commands"
  ],
  "properties": {
    "name": {
      "type": "string",
      "minLength": 1,
      "description": "Unique renderer identifier; must match the directory basename"
    },
    "language": {
      "type": "string",
      "enum": ["react", "vue", "svelte", "react-native"]
    },
    "converter": {
      "type": "string",
      "minLength": 1,
      "description": "Name of the converter agent (an agent file at .claude/agents/<converter>.md)"
    },
    "detect": {
      "type": "object",
      "additionalProperties": false,
      "required": ["configFiles", "dependencies"],
      "properties": {
        "configFiles": {
          "type": "array",
          "items": { "type": "string" },
          "description": "Glob strings matched against project files (basename)"
        },
        "dependencies": {
          "type": "array",
          "items": { "type": "string" },
          "description": "Package names matched against the project's deps/devDeps"
        },
        "priority": {
          "type": "integer",
          "default": 0,
          "description": "Higher priority wins when multiple renderers match"
        }
      }
    },
    "template": {
      "type": "string",
      "minLength": 1,
      "description": "Path to the starter template directory"
    },
    "component": {
      "type": "object",
      "additionalProperties": false,
      "required": ["ext"],
      "properties": {
        "ext": { "type": "string", "minLength": 1 },
        "islandExt": { "type": "string" },
        "dir": { "type": "string" },
        "pageRouting": {
          "type": "string",
          "enum": ["app-router", "pages", "file-based", "screens"]
        }
      }
    },
    "test": {
      "type": "object",
      "additionalProperties": false,
      "required": ["runner", "library"],
      "properties": {
        "runner": { "type": "string", "minLength": 1 },
        "library": { "type": "string", "minLength": 1 },
        "setup": { "type": "string" },
        "containerApi": { "type": "boolean" }
      }
    },
    "commands": {
      "type": "object",
      "additionalProperties": false,
      "required": ["dev", "build", "test"],
      "properties": {
        "dev": { "type": "string", "minLength": 1 },
        "build": { "type": "string", "minLength": 1 },
        "test": { "type": "string", "minLength": 1 }
      }
    },
    "phases": {
      "type": "object",
      "additionalProperties": false,
      "required": ["exclude"],
      "properties": {
        "exclude": {
          "type": "array",
          "items": { "type": "string" }
        }
      }
    },
    "capabilities": {
      "type": "object",
      "additionalProperties": false,
      "properties": {
        "islands": { "type": "boolean" },
        "ssr": { "type": "boolean" },
        "darkMode": { "type": "boolean" }
      }
    }
  }
}
