{
  "name": "nextjs",
  "language": "react",
  "converter": "figma-react-converter",
  "detect": {
    "configFiles": ["next.config.*"],
    "dependencies": ["next"],
    "priority": 10
  },
  "template": "templates/nextjs",
  "component": {
    "ext": ".tsx",
    "dir": "components",
    "pageRouting": "app-router"
  },
  "test": {
    "runner": "vitest",
    "library": "@testing-library/react"
  },
  "commands": {
    "dev": "pnpm dev",
    "build": "pnpm build",
    "test": "pnpm vitest run"
  }
}
