{
  "name": "vite",
  "language": "react",
  "detect": {
    "configFiles": ["vite.config.*"],
    "dependencies": ["vite"],
    "priority": 5
  },
  "template": "templates/vite",
  "component": {
    "ext": ".tsx",
    "dir": "src/components",
    "pageRouting": "file-based"
  },
  "test": {
    "runner": "vitest",
    "library": "@testing-library/react"
  },
  "converter": "figma-react-converter",
  "commands": {
    "dev": "pnpm dev",
    "build": "pnpm build",
    "test": "pnpm vitest run"
  },
  "capabilities": {
    "islands": false,
    "ssr": false,
    "darkMode": true
  }
}
