{
  "name": "expo",
  "language": "react-native",
  "detect": {
    "configFiles": ["app.json", "app.config.*"],
    "dependencies": ["expo"],
    "priority": 25
  },
  "template": "templates/expo",
  "component": {
    "ext": ".tsx",
    "dir": "src/components",
    "pageRouting": "screens"
  },
  "test": {
    "runner": "jest",
    "library": "@testing-library/react-native"
  },
  "converter": "react-native-converter",
  "commands": {
    "dev": "pnpm expo start",
    "build": "pnpm expo export",
    "test": "pnpm jest"
  },
  "phases": {
    "exclude": ["visual-diff", "cross-browser", "responsive", "dark-mode"]
  },
  "capabilities": {
    "islands": false,
    "ssr": false,
    "darkMode": false
  }
}
